{
  "version": "1.0",
  "type": "repository",
  "interval": "month",
  "date": "2026-01-01",
  "generatedAt": "2026-01-23T23:16:21.873Z",
  "sourceLastUpdated": "2026-01-23T23:16:21.873Z",
  "contentFormat": "markdown",
  "contentHash": "8895b1753931b58ea1b12ea74bf24be491e4d5a62af23552f411d032f211b8ce",
  "entity": {
    "repoId": "elizaos/elizaos.github.io",
    "owner": "elizaos",
    "repo": "elizaos.github.io"
  },
  "content": "# elizaos/elizaos.github.io Monthly Report (January 2026)\n\n## üöÄ Highlights\nJanuary was a foundational month for ElizaOS, characterized by a shift toward gamified contributor engagement and robust infrastructure maintenance. The project introduced a sophisticated MMORPG-style character progression system for its leaderboard, signaling a move toward a more interactive and rewarding contributor experience. Parallel to these feature developments, the team prioritized repository health by automating dependency management and upgrading core CI/CD workflows. This month successfully balanced long-term architectural planning for \"Orders and Evolution\" with immediate technical refinements to the site's RSS and deployment pipelines.\n\n## üõ†Ô∏è Key Developments\n\n### Gamified Contributor Ecosystem\nThe most significant feature update this month was the transformation of the leaderboard into a rich, MMORPG-inspired progression system.\n*   **Character Progression API:** Implemented a system inspired by Ragnarok Online that converts contributor focus areas from simple tags into complex objects containing scores and percentages ([#193](https://github.com/elizaos/elizaos.github.io/pull/193)).\n*   **Evolution Planning:** Extensive groundwork was laid for an \"Orders and Evolution\" class system. This includes defining a hierarchy from \"Contributor\" to \"Architect,\" allowing users to choose evolution paths at specific thresholds, and tracking \"profile lore\" through class transitions ([#194], [#195], [#196]).\n*   **Visual Identity:** Plans were formalized to assign unique sigils, primary colors, and accents to different contributor Orders to enhance UI distinction ([#197]).\n\n### Infrastructure & Automation\nSignificant effort was directed toward ensuring the project's long-term maintainability and security.\n*   **Automated Dependency Management:** Integrated Dependabot to handle routine updates, alongside a human-readable XSL stylesheet for the RSS feed to improve browser rendering ([#188](https://github.com/elizaos/elizaos.github.io/pull/188)).\n*   **Workflow & Core Upgrades:** Updated critical GitHub Actions (Checkout, Configure-Pages, and Upload-Pages-Artifact) to their latest versions ([#189](https://github.com/elizaos/elizaos.github.io/pull/189), [#190](https://github.com/elizaos/elizaos.github.io/pull/190), [#191](https://github.com/elizaos/elizaos.github.io/pull/191)).\n*   **Database & UI Libraries:** Bumped core dependencies including `drizzle-orm` (from 0.41.0 to 0.45.1) and `lucide-react` to leverage recent performance fixes and features ([#201](https://github.com/elizaos/elizaos.github.io/pull/201)).\n\n## üêõ Issues & Triage\n\n### Closed Issues\n*   **Operational Stability:** Resolved long-standing issues regarding deployment testing within new organizations and implemented preemptive mitigations for GitHub API rate limits ([#69], [#73]).\n*   **Reporting UX:** Improved the readability of automated reports by extending the grouped organization/repository format to daily, weekly, and monthly summaries ([#200]).\n\n### New & Active Issues\n*   **System Customization:** New issues focus on making the character system highly configurable, such as allowing class thresholds to be defined via `config/example.json` ([#199]) and implementing \"respec\" mechanics with cooldown periods to preserve historical data ([#198]).\n*   **Scalability:** Ongoing discussions revolve around how to best represent complex contributor data across multiple repositories without sacrificing UI clarity.\n\n## üí¨ Community & Collaboration\nThe activity this month reflects a high level of internal coordination, particularly regarding the conceptual design of the contributor \"Evolution\" system. While the technical implementation was concentrated in a few major PRs, the opening of multiple planning issues ([#194] through [#200]) suggests a collaborative effort to define the social and technical architecture of the ElizaOS community. The rapid adoption of automated dependency tools indicates a commitment to lowering the barrier for future contributors by maintaining a clean, modern codebase."
}