{
  "version": "1.0",
  "type": "repository",
  "interval": "day",
  "date": "2025-05-13",
  "generatedAt": "2026-01-22T06:46:16.178Z",
  "sourceLastUpdated": "2026-01-22T06:46:16.178Z",
  "contentFormat": "markdown",
  "contentHash": "01e270015f472a1da514b6759a3751950c4dc5669d90455ba86e2732c662b978",
  "entity": {
    "repoId": "elizaos/eliza",
    "owner": "elizaos",
    "repo": "eliza"
  },
  "content": "# ElizaOS Daily Update (May 13, 2025)\n\n## OVERVIEW \nToday, significant advancements were made in the ElizaOS project, focusing on enhancing the CLI functionality and supporting third-party plugin installations. Key bug fixes were implemented to improve system stability, particularly in the plugin and CI areas. The team also addressed several issues related to error handling and logging, contributing to a more robust development environment.\n\n## KEY TECHNICAL DEVELOPMENTS\n\n### Feature Enhancements\n- Improved CLI functionality for the ElizaOS agent command, fixing issues with JSON output and file saving ([#4560](https://github.com/elizaos/eliza/pull/4560)).\n- Added support for third-party plugin installations, including a refactor of the plugin install code and the addition of relevant tests ([#4568](https://github.com/elizaos/eliza/pull/4568)).\n\n### Bug Fixes\n- Resolved a critical issue in the `service.ts` file due to improper merge conflict resolution, restoring several missing methods ([#4552](https://github.com/elizaos/eliza/pull/4552)).\n- Updated CI TEE configurations to enhance continuous integration processes ([#4572](https://github.com/elizaos/eliza/pull/4572)).\n- Adjusted Telegram message manager tests to expect 'MarkdownV2' for message sending ([#4570](https://github.com/elizaos/eliza/pull/4570)).\n\n## CLOSED ISSUES\n- No issues were closed today.\n\n## NEW ISSUES\n\n### Documentation and Dependency Challenges\n- Encountered a 404 error for missing documentation paths in the repository, specifically for the i18n readme ([#4565](https://github.com/elizaos/eliza/issues/4565)).\n- A request to publish to npm was raised due to peer dependency conflicts with the zod library, causing build issues in another repository ([#4562](https://github.com/elizaos/eliza/issues/4562)).\n- An error was reported from CI activity, indicating potential issues with the continuous integration setup ([#4561](https://github.com/elizaos/eliza/issues/4561))."
}