{
  "version": "1.0",
  "type": "repository",
  "interval": "day",
  "date": "2025-07-06",
  "generatedAt": "2026-01-29T23:17:46.923Z",
  "sourceLastUpdated": "2026-01-29T23:17:46.923Z",
  "contentFormat": "markdown",
  "contentHash": "1b94e1da1306dfff748fb2d544b478e7bd8697379068379e305992bffce96894",
  "entity": {
    "repoId": "elizaos/eliza",
    "owner": "elizaos",
    "repo": "eliza"
  },
  "content": "# elizaos/eliza Daily Update (Jul 6, 2025)\n## OVERVIEW \nToday, ElizaOS significantly enhanced its documentation, introducing a two-track system for users and developers. Key bug fixes addressed API client responses and Windows plugin loading. Development also focused on code quality with extensive linting and CI/CD improvements.\n\n## KEY TECHNICAL DEVELOPMENTS\n\n### Documentation & Type Safety Improvements\nA major documentation overhaul was completed, introducing a two-track system to cater to both simple users and developers, significantly improving accessibility and clarity ([#5401](https://github.com/elizaos/eliza/pull/5401)). Additionally, TypeScript type safety was enhanced in the Docusaurus configuration by replacing generic 'any' types with proper interfaces ([#5418](https://github.com/elizaos/eliza/pull/5418)). JSDoc comments in the core package were also fixed to ensure parameter names match function signatures ([#5414](https://github.com/elizaos/eliza/pull/5414)).\n\n### Bug Fixes and Platform Compatibility\nCritical bug fixes were implemented to handle unwrapped server responses in the `BaseApiClient`, resolving issues with API calls failing ([#5343](https://github.com/elizaos/eliza/pull/5343)). A specific fix was also deployed to address plugin loading issues on Windows environments when using Bun ([#5416](https://github.com/elizaos/eliza/pull/5416)).\n\n### Code Quality and CI/CD Enhancements\nExtensive linting was performed across the entire codebase to ensure consistent formatting and maintain high code quality standards ([#5422](https://github.com/elizaos/eliza/pull/5422), [#5420](https://github.com/elizaos/eliza/pull/5420)). Furthermore, CI workflows were updated to use `actions/upload-artifact@v4` for improved reliability and performance, and test timeouts were adjusted for Windows CI environments ([#5412](https://github.com/elizaos/eliza/pull/5412), [#5423](https://github.com/elizaos/eliza/pull/5423)).\n\n## NEWLY OPENED PULL REQUESTS\n- A new pull request, [#5421](https://github.com/elizaos/eliza/pull/5421) \"Create Os\", has been opened.\n- Another pull request, [#5417](https://github.com/elizaos/eliza/pull/5417) \"chore: 1.0.18\", is also newly opened.\n\n## CLOSED ISSUES\n\n### Documentation and Code Consistency\nThe issue regarding JSDoc parameter mismatches in the core package has been resolved, ensuring documentation accuracy ([#5410](https://github.com/elizaos/eliza/issues/5410)).\n\n### GUI and User Interface Review\nThe review of the actions tab in the GUI has been completed and closed, with a suggestion to rename the tab to `Model Calls` ([#5377](https://github.com/elizaos/eliza/issues/5377)).\n\n## NEW ISSUES\n\n### Agent Behavior Anomaly\nA new issue has been reported where agents interpret conversations as direct messages and always respond if \"DM\" is included in the user's name when chatting over an AgentServer socket ([#5425](https://github.com/elizaos/eliza/issues/5425)).\n\n## ACTIVE ISSUES\n\n### Documentation Overhaul Progress\nThe documentation overhaul issue ([#5234](https://github.com/elizaos/eliza/issues/5234)) is still active. The latest comment from SYMBaiEX at 2025-07-06T08:23:00Z suggests that the issue needs to be closed or updated, indicating significant progress or completion. Earlier comments highlighted the need for separate documentation tracks for simple users and developers, and frustrations from new users regarding scattered and inconsistent setup instructions, particularly for Twitter integration and character JSON files.\n\n### Twitter Interaction Conflict\nThe conflict issue between `TWITTER_INTERACTION_ENABLE` and `TWITTER_TARGET_USERS` ([#21](https://github.com/elizaos/eliza/issues/21)) remains open. The latest comment from wtfsayo at 2025-07-06T11:04:42Z asks for testing of the latest version to see if the issue has been resolved, suggesting ongoing efforts to address this long-standing problem."
}