{
  "version": "1.0",
  "type": "repository",
  "interval": "day",
  "date": "2026-01-09",
  "generatedAt": "2026-01-09T23:14:07.916Z",
  "sourceLastUpdated": "2026-01-09T23:14:07.916Z",
  "contentFormat": "markdown",
  "contentHash": "3904c21cadd35176d5572fa2ad4234c368c86e2daa33c8ad91ad5a9c9cd79428",
  "entity": {
    "repoId": "elizaos-plugins/plugin-twitter",
    "owner": "elizaos-plugins",
    "repo": "plugin-twitter"
  },
  "content": "# elizaos-plugins/plugin-twitter Daily Update (Jan 9, 2026)\n## OVERVIEW \nToday, the `plugin-twitter` repository saw a significant feature addition with the implementation of OAuth2 PKCE authentication, enhancing security and maintaining backward compatibility.\n\n## KEY TECHNICAL DEVELOPMENTS\n\n### Enhanced Authentication with OAuth2 PKCE\nA major feature was introduced to support 3-legged \"login + approve\" Twitter/X authentication using OAuth 2.0 Authorization Code + PKCE. This update improves security by not shipping any client secret while ensuring full backward compatibility with the existing OAuth 1.0a environment variable setup. This involved extensive changes across authentication providers and related client components. ([#46](https://github.com/elizaos-plugins/plugin-twitter/pull/46))\n\n## NEWLY OPENED PULL REQUESTS\nNo new pull requests were opened today.\n\n## CLOSED ISSUES\nNo issues were closed today.\n\n## NEW ISSUES\nNo new issues were reported today.\n\n## ACTIVE ISSUES\nNo issues had more than 3 comments today."
}