{
  "version": "1.0",
  "type": "repository",
  "interval": "day",
  "date": "2026-01-27",
  "generatedAt": "2026-01-30T23:18:18.343Z",
  "sourceLastUpdated": "2026-01-30T23:18:18.343Z",
  "contentFormat": "markdown",
  "contentHash": "7dca9530b8d58d82cd727712377b6ea486ba563598c4ba56c5b08468ed584be2",
  "entity": {
    "repoId": "elizaos/elizaos.github.io",
    "owner": "elizaos",
    "repo": "elizaos.github.io"
  },
  "content": "# elizaos/elizaos.github.io Daily Update (Jan 27, 2026)\n## OVERVIEW \nToday's development focused entirely on dependency updates, ensuring the project utilizes the latest versions of key libraries for improved stability and features.\n\n## KEY TECHNICAL DEVELOPMENTS\n\n### Dependency Updates for Core Libraries\n*   Updated `next` from 15.4.10 to 16.1.4, bringing the project up to the latest version of the Next.js framework. [#236](https://github.com/elizaos/elizaos.github.io/pull/236)\n*   Bumped `commander` from 12.1.0 to 14.0.2, updating the command-line interface parsing library. [#237](https://github.com/elizaos/elizaos.github.io/pull/237)\n*   Upgraded `glob` from 11.1.0 to 13.0.0, updating the file system globbing utility. [#234](https://github.com/elizaos/elizaos.github.io/pull/234)\n\n### UI Component and Utility Library Updates\n*   Updated `recharts` from 2.15.4 to 3.6.0, impacting `RepositoryCard.tsx` and `chart.tsx`. [#204](https://github.com/elizaos/elizaos.github.io/pull/204)\n*   Bumped `lucide-react` from 0.562.0 to 0.563.0 and `prettier` to their latest minor and patch versions. [#233](https://github.com/elizaos/elizaos.github.io/pull/233)\n\n## NEWLY OPENED PULL REQUESTS\nNo new pull requests were opened today.\n\n## CLOSED ISSUES\nNo issues were closed today.\n\n## NEW ISSUES\nNo new issues were reported today.\n\n## ACTIVE ISSUES\nNo active issues with more than 3 comments."
}