{
  "version": "1.0",
  "type": "repository",
  "interval": "week",
  "date": "2025-11-16",
  "generatedAt": "2026-01-20T23:15:08.234Z",
  "sourceLastUpdated": "2026-01-20T23:15:08.234Z",
  "contentFormat": "markdown",
  "contentHash": "6a3d6e4cc281518d9ec5a16531d8d3824c2c89c6e6f2a4c684c2d9ee542192fb",
  "entity": {
    "repoId": "elizaos/eliza",
    "owner": "elizaos",
    "repo": "eliza"
  },
  "content": "# elizaos/eliza Weekly Report (Nov 16 - 22, 2025)\n\n## üöÄ Highlights\nThis week's efforts balanced proactive technical debt reduction with responsiveness to critical user feedback. The most significant achievement was the migration of the core package away from a deprecated LangChain version, ensuring long-term stability. Concurrently, the team triaged a number of new user-reported issues, including a critical migration problem and several feature requests for new integrations and UI improvements. This activity highlights a healthy feedback loop between the development team and the project's active user base.\n\n## üõ†Ô∏è Key Developments\nWork this week focused on modernizing dependencies and performing routine documentation maintenance.\n\n- **Core Dependency Modernization:** A major effort was completed to enhance the stability of `@elizaos/core` by migrating from the deprecated `langchain` v0.3 to `@langchain/textsplitters v1.0`. This involved updating dependencies, import paths, and removing outdated resolutions from plugin starter packages, resolving a long-standing deprecation issue ([#6152](https://github.com/elizaos/eliza/pull/6152)).\n\n- **Documentation & Maintenance:** To improve user experience and accuracy, outdated links in the `packages/cli/README.md` were corrected ([#6050](https://github.com/elizaos/eliza/pull/6050)). A new pull request was also opened to improve markdown spacing compactness ([#6159](https://github.com/elizaos/eliza/pull/6159)). Additionally, a minor dependency bump for `glob` from `11.0.3` to `11.1.0` was proposed ([#6157](https://github.com/elizaos/eliza/pull/6157)).\n\n## üêõ Issues & Triage\nThe week saw one key issue resolved while several new critical issues and feature requests were opened, indicating active community engagement.\n\n- **Closed Issues:** The primary issue closed this week concerned the deprecation of LangChain v0.3 ([#6145](https://github.com/elizaos/eliza/issues/6145)). This was resolved by the successful migration to `@langchain/textsplitters` in PR [#6152](https://github.com/elizaos/eliza/pull/6152).\n\n- **New & Active Issues:** Several important issues were reported by the community:\n    - **Critical Migration Issue:** A user reported significant problems with the AI16Z ‚Üí ElizaOS migration, including snapshot eligibility and unsupported Tangem Wallet connections. This is a high-priority issue tracked in [#6158](https://github.com/elizaos/eliza/issues/6158).\n    - **Feature Requests:** The community proposed several enhancements, including potential integration of the DeepSeek API ([#6156](https://github.com/elizaos/eliza/issues/6156]), support for Farcaster and Base applications ([#6161](https://github.com/elizaos/eliza/issues/6161)), and a UI improvement to make addresses clickable hyperlinks ([#6160](https://github.com/elizaos/eliza/issues/6160)).\n\n## üí¨ Community & Collaboration\nWhile there were no reports of high-volume discussions on specific PRs, community engagement was evident through the influx of new issues. Users are actively testing the system and providing valuable feedback, from identifying critical bugs like the migration issue ([#6158](https://github.com/elizaos/eliza/issues/6158)) to suggesting future directions for the project with feature requests for new API integrations and ecosystem support. The report of a compromised Discord channel within an issue highlights the community's role in safeguarding the project's communication channels."
}