{
  "version": "1.0",
  "type": "repository",
  "interval": "day",
  "date": "2026-02-07",
  "generatedAt": "2026-02-07T23:19:09.505Z",
  "sourceLastUpdated": "2026-02-07T23:19:09.505Z",
  "contentFormat": "markdown",
  "contentHash": "2d32c7ac2010f54b84bb3b1fd3a647356f2f701a56d4d693d483921b6bf7ef8b",
  "entity": {
    "repoId": "elizaos-plugins/registry",
    "owner": "elizaos-plugins",
    "repo": "registry"
  },
  "content": "# elizaos-plugins/registry Daily Update (Feb 7, 2026)\n## OVERVIEW \nToday, the `elizaos-plugins/registry` repository saw new plugin development with the introduction of a transaction guardrail for AI agents and a DEX plugin for perp trading. Discussions continued on the \"Add Cost Evaluator\" issue.\n\n## KEY TECHNICAL DEVELOPMENTS\n\n## NEWLY OPENED PULL REQUESTS\n- A new feature to add `@proofgate/eliza-plugin` for AI agent transaction guardrails was opened [#257](https://github.com/elizaos-plugins/registry/pull/257).\n- A new pull request was opened to add the Arthur DEX plugin, enabling Orderly Network perp trading [#256](https://github.com/elizaos-plugins/registry/pull/256).\n\n## CLOSED ISSUES\n\n## NEW ISSUES\n\n## ACTIVE ISSUES\n- **Cost Evaluator for LLM Usage:** Discussion continued on [#5759](https://github.com/elizaos-plugins/registry/issues/5759), which proposes adding an evaluator to estimate the dollar cost of LLM usage per step based on token counts. The latest comment from ralyodio at 2026-02-07T16:36:03Z affirmed the necessity of this feature."
}